cid,name,address,architect,artists,built,caption,clergy,consecrated,dedication,denomination,englishname,fax,image,national,phone,titular,type,url
1500,"All Saints","153/b Via del Babuino 00187 Roma","George Edmund Street",,1880&ndash;1887,,"Church of England clergy",,,"Anglican Communion / Church of England","All Saints",,,N/A,"06 3600 1881",N/A,,http://www.allsaintsrome.org
3128,"Angelo Custode","Via del Tritone (present site)",,,1624,,,,"Guardian Angel","Roman Catholic","Guardian Angel",,,,,,Demolished,
4880,"Annunciazione della Villa Flaminia","Viale del Vignola 56",,,"1960's",,,1968,"Blessed Virgin Mary (Annunciation)","Roman Catholic","Annunciation at the Villa Flaminia",,,,,,,
3144,"Ascensione di Nostro Signore Gesù Cristo","Via Manfredonia 5",,,1954,,,,Ascension,"Roman Catholic","Ascension of Our Lord Jesus Christ",,,,,,,
3145,"Assunzione di Maria","Viale Spartico 11",,,"1960's (unfinished)",,,,"Blessed Virgin Mary (Assumption)","Roman Catholic","Assumption of Mary",,,,,,,
1932,"Bambin Gesù all'Esquilino","Via Urbana 1 00184 Roma","Carlo Buratti, Ferdinando Fuga",,"1731 t0 1736",,"Oblates of the Child Jesus",1736,"Jesus Christ as the Holy Child","Roman Catholic","The Holy Child at the Esquiline",,,,"06 48 83 700",,,
4076,"Basilica Anonima della Via Ardeatina","Via Ardeatina, 600 m from ''Domine Quo Vadis'' (driveway from Via Appia Antica)",,,"4th century",,,,"Unknown, perhaps Pope St Mark","Roman Catholic","Anonymous Basilica on the Ardeatine Way",,,,,,,
4091,"Basilica dei Gordiani","Villa Gordiani, Via Prenestina",,,"4th century",,,,Unknown,"Roman Catholic","Basilica of the Gordiani",,,,,,Ruined,
3748,"Basilica di Santo Stefano Protomartire a Via Latina","Tombs of the Via Latina Archeological Park, Via dell'Arco di Travertino",,,"5th century",,,,"Stephen the Protomartyr","Roman Catholic","St Stephen the Protomartyr on the Latin Way, Basilica of",,,,,,Ruined,
3799,"Basilica e Catacomba di San Valentino","Viale Maresciallo Pilsudski",,,"4th century",,,,Valentine,"Roman Catholic","St Valentine, Basilica of",,,,,,"Deconsecrated and ruined",
4095,"Basilica e Catacomba di Sant'Ermete","Via Antonio Bertoloni 24",,,"Late 4th century",,,,"Hermes of Rome","Roman Catholic","St Hermes",,,,,,Deconsecrated,
4075,"Basilica e Catacombe di Generosa","Via delle Catacombe di Generosa",,,,,,,"Portuensian Martyrs (Simplicius, Faustinus and Beatrice)","Roman Catholic","Basilica and Catacombs of Generosa",,,,,,,
4510,"Beato Nicola de Rupe","Via del Quirinale 30",,,1735,,,,"Nicholas von Flüe","Roman Catholic","Blessed Nicholas of the Crag",,,,,,Deconsecrated,
3651,"Beato Pier Giorgio Frassati","Via Giovanni Artusi 42",,,"Late 20th century",,,,"Pier Giorgio Frassati","Roman Catholic","Blessed Peter-George Frassati",,,,,,,
3679,"Beato Zefferino Gimènez Malla","Santuario della Madonna del Divino Amore",,,2004,,,,"Zephyrinus Gimenez Molla","Roman Catholic","Blessed Zephyrinus Gimenez Molla",,,,,,,
3160,"Buono e Perpetuo Soccorso","Via Merulana 170",,,1878,,,,"Blessed Virgin Mary (Our Lady's Help)","Roman Catholic","Good and Perpetual Help",,,,,,,
4948,"Cappella Molino","Via Ardeatina",,,"20th century",,,,?,"Roman Catholic","Windmill Chapel",,,,,,,
4731,"Cappella Paolina al Quirinale","Palazzo del Quirinale","Carlo Maderno",,1616,,,,"Blessed Virgin Mary (Assumption)","Roman Catholic","Pauline Chapel",,,,,,"Papal chapel",
1949,"Cappella Sistina","Vatican City","Giovannino dei Dolci(?)","Michelangelo et.al.",1473&ndash;1477,,,,"Blessed Virgin Mary (Assumption)","Roman Catholic","Sistine Chapel",,,,,,"Papal chapel",
5055,"Cappella dei Pamphilj","Viale del Maglio, Villa Doria Pamphilj",,,1902,,,,?,"Roman Catholic","Chapel of the Pamphilj",,,,,,,
4946,"Cappella del Casale della Falcognana di Sopra","Via Ardeatina 1491",,,"17th century",,,,?,"Roman Catholic","The Chapel at Upper Falcognana Farm",,,,,,,
4911,"Cappella del Pontificio Collegio Pio Brasiliano","Via Aurelia 527",,,1966,,,,?,"Roman Catholic","Chapel of the Pontifical Pious Brazilian College",,,,,,,
4914,"Cappella del Pontificio Collegio Scozzese","Via Cassia 481",,,1964,,,,?,"Roman Catholic","Chapel of the Pontifical Scots College",,,,,,,
5395,"Cappella della Compagnia della Regina dei Gigli","Viale Jonio 286",,,1972,,,,"Blessed Virgin Mary","Roman Catholic","Chapel of the Company of the Queen of the Lilies",,,,,,Deconsecrated,
3902,"Cappella di Reginald Pole","Via Appia Antica 57",,,"Mid 16th century",,,,?,"Roman Catholic","Chapel of Reginald Pole",,,,,,,
4657,"Casale di Perna, Cappella del","Via Valle di Perna 315",,,"18th century",,,,?,"Roman Catholic","Chapel of the Perna Farm",,,,,,Deconsecrated,
4765,"Catacombe di Priscilla","Via Salaria 430",,,"3rd century, 4th century, early 20th century",,,,"Priscilla, Pope Sylvester I","Roman Catholic","Catacombe di Priscilla",,,,,,,
4779,"Cenacolo Cuore di Gesù","Via dei Casali di Torrevecchia 11",,,"20th century",,,,"Sacred Heart","Roman Catholic","Cenacle, Sacred Heart of Jesus",,,,,,,
3676,"Chiesa Centrale della Università Cattolica del Sacro Cuore","Largo Francesco Vito 1",,,"20th century",,,,"Sacred Heart?","Roman Catholic","Central Church of the Catholic University of the Sacred Heart",,,,,,,
1960,"Chiesa Nuova","134 Via del Governo Vecchi (Piazza della Chiesa Nuova)","Giovanni Matteo da Città di Castello, Giacomo della Porta, Martino Longhi the Elder",,1575&ndash;1599,,,1599,"Gregory the Great and Blessed Virgin Mary","Roman Catholic","The New Church",,,,,,,
3734,"Chiesa della Sapienza","Piazzale Aldo Moro 1 (through gate, first left)",,,1948,,,,"Holy Wisdom","Roman Catholic","Wisdom, Church of",,,,,,,
3798,"Chiesa di Villa di Plinio","Viale della Villa di Plinio (the church is down a track leading north-east of the villa ruins)",,,"4-5th century",,,,Unknown,"Roman Catholic","Church of Villa of Pliny",,,,,,Ruined,
3290,"Corpus Christi alla Garbatella","Via Pomponia Grecina 31",,,"Mid 20th century",,,,"Jesus Christ (Corpus Christi)","Roman Catholic","Body of Christ at Garbatella",,,,,,,
3407,"Corpus Domini a Massimina","Via Giuseppe Vanni 53",,,"20th century",,,,"Jesus Christ (Corpus Christi)","Roman Catholic","Body of Christ at Massimina",,,,,,,
4918,"Corpus Domini al Nomentano","8 Via Nomentana 00161 Roma","Carlo Busiri Vici, Verhaegen","Virginio Monti, Eugenio Cisterna",1886&ndash;1889,,,"18 June 1889","Jesus Christ in the Eucharist","Roman Catholic","Body of the Lord",,,,"06 44 23 06 06",,"Convent church",
3291,"Corpus Domini alla Garbatella","Via delle Sette Chiese 91",,,"1950's",,,,"Jesus Christ (Corpus Christi)","Roman Catholic","Body of the Lord at Garbatella",,,,,,,
3375,"Cristo Re a Morena",,,,1986,,,,"Jesus Christ","Roman Catholic","Christ the King at Morena",,,,,,,
4795,"Cristo Re delle Suore Francescane della Beata Angelina","Via Giorgio Bolognetti 4",,,"20th century",,,,"Jesus Christ","Roman Catholic","Christ the King of the Franciscan Sisters of Blessed Angelina",,,,,,,
3006,"Dio Padre Misericordioso","Largo Terzo Millennio 8-9",,,2003,,,,"God the Father","Roman Catholic","God the Merciful Father",,,,,,,
4890,"Divino Amore delle Religiose dell'Assunzione","Via Alessandro Viviani 24",,,"20th century",,,,"Holy Spirit","Roman Catholic","Divine Love of the Religious of the Assumption",,,,,,,
1974,"Domine Quo Vadis","Via Appia Antica",,,1637,,,,"Blessed Virgin Mary (Our Lady of Sorrows)","Roman Catholic","Chapel of ""Domine Quo Vadis""",,,,,,,
4648,"Gesù Adolescente a Via Prenestina","Via Prenestina 468",,,,,,,"Jesus (as a boy at Nazareth)","Roman Catholic","Boy Jesus at Prenestina Way",,,,,,,
4955,"Gesù Bambino a Sacco Pastore","Via Campi Flegrei 40",,,1959,,,,"Jesus (as a Child)","Roman Catholic","Baby Jesus at the Shepherds Purse",,,,,,,
1993,"Gesù Buon Pastore alla Montagnola","Via Luigi Perna 3 00142 Roma","Carlo Bodini",,1950-59,,"Society of St Paul","18 March 1859","Jesus Christ the Good Shepherd","Roman Catholic","Jesus the Good Shepherd at Montagnola",,,,"06 54 01 387","Velasio de Paolis","Parish and titular church",
3222,"Gesù Divin Salvatore","Via Romolo Gigliozzi 31",,,1992,,,,"Jesus Christ","Roman Catholic","Jesus the Divine Saviour",,,,,,,
4395,"Gesù Divino Lavoratore","Via Oderisi da Gubbio 16",,,1960,,,,"Jesus Christ the Worker","Roman Catholic","Jesus the Divine Worker",,,,,,,
4755,"Gesù Divino Maestro","Via Vittorio Montiglio 18",,,1967,,,,"Christ the Divine Master","Roman Catholic","Jesus the Divine Master",,,,,,,http://www.vicariatusurbis.org/Ente.asp?ID
4587,"Gesù Nazareno all'Argentina","Via dei Barbieri 22/A",,,1724,,,,"Jesus of Nazareth",Catholic,"Jesus the Nazarene at the Argentina",,,,,,,
4643,"Gesù Risorto","Cimitero Laurentino, Via Laurentina Km 13.5",,,2012,,,,"Jesus Christ","Roman Catholic","Jesus Risen",,,,,,,
3034,"Gesù di Nazareth","Via Igino Giordani 5",,,1988,,,,"Jesus of Nazareth (the hidden years of his life)",Catholic,"Jesus of Nazareth",,,,,,,
1513,"Gesù e Maria","45 Via del Corso","Carlo Maderno, Girolamo Rainaldi","Giacinto Brandi",,,,,"The Holy Names of Jesus and Blessed Virgin Mary","Roman Catholic","Jesus and Mary",,,,,,,
4515,"Gesù, Maria e Giuseppe","Via del Babuino 153",,,"17th century",,,,"Holy Family","Roman Catholic","Jesus, Mary and Joseph",,,,,,Demolished,
1507,"Gran Madre di Dio","1 Via Cassia 00191 Roma","Cesare Bazzani, Clemente Busiri Vici",,1933&ndash;1937,,,1937,"Blessed Virgin Mary","Roman Catholic","Great Mother of God",,,No,"06 33 39 340",Yes,"Parish church",
1991,"Il Gesù","16 Via degli Astalli / Piazza del Gesù  00186 Roma","Vignola, Giacomo della Porta",,1568&ndash;1584,,"Society of Jesus",1584,"The name of Jesus Christ","Roman Catholic","Most Holy Name of Jesus",,,,06-69.70.01,"Eduardo Martinez Somalo",,
4973,"Immacolata Concezione a Piana del Sole","Via Cristoforo Sabbadino 73",,,"20th century",,,,"Blessed Virgin Mary (Immaculate Conception)","Roman Catholic","Immaculate Conception at the Plain of the Sun",,,,,,,
4974,"Immacolata Concezione d'Ivrea","Via di Val Cannuta 200",,,1973,,,,"Blessed Virgin Mary","Roman Catholic","Immaculate Conception of Ivrea",,,,,,,
4052,"Immacolata Concezione dell'Asilo Pio XII","Via Pietro Ottoboni 9",,,1945,,,,?,"Roman Catholic","Immaculate Conception of the Pius XII Shelter",,,,,,Deconsecrated,
4627,"Immacolata Concezione di Nostra Signora di Lourdes a Via Sistina","Via Sistina 113",,,"19th century",,,,"Blessed Virgin Mary","Roman Catholic","Immaculate Conception of Our Lady of Lourdes on the Sistine Way",,,,,,,
3267,"Incarnazione del Verbo Divino","Via XX Settembre",,,"17th century",,,,"Jesus Christ","Roman Catholic","Incarnation of the Divine Word",,,,,,Demolished,
2039,"La Maddalena","Piazza della Maddalena 53br> 00186 Roma","Carlo Fontana, G.C. Quadrio","Aureliano Milani","1669 to 1698",,"Priests, Ministers of the Sick (Camillans)",,"Mary Magdalene","Roman Catholic","The Magdalene",,,,"06 89 92 81",,"National church",
3138,"L’Annunziatella","Via di Grotta Perfetta 591",,,1220,,,,"Blessed Virgin Mary (Annunciation)","Roman Catholic","Little Annunciation",,,,,,,
3579,"Madonna dei Lumi","Via Chirone 27",,,"20th century",,,,"Blessed Virgin Mary","Roman Catholic","Our Lady of Lights",,,,,,,
3580,"Madonna del Buon Consiglio a Tor di Mezza Via","Via Appia Nuova 1267",,,"16th century",,,,"Blessed Virgin Mary (Our Lady of Good Counsel)","Roman Catholic","Our Lady of Good Counsel at the Middle Way Tower",,,,,,,
4796,"Madonna del Buon Consiglio delle Suore Serve di Maria Addolorata","Via Giacomo Corradi 15",,,"20th century",,,,"Blessed Virgin Mary","Roman Catholic","Our Lady of Good Counsel of the Sisters, Servants of Mary of Sorrows",,,,,,,
4945,"Madonna del Cenacolo","Piazza Madonna del Cenacolo 15",,,"Mid 20th century",,,,"Blessed Virgin Mary","Roman Catholic","Our Lady of the Cenacle",,,,,,,
3581,"Madonna del Lavoro","Via Francesco Scaduto 23",,,"1930's",,,,"Blessed Virgin Mary","Roman Catholic","Our Lady of Work",,,,,,,
5036,"Madonna del Rosario a Casetta Mattei","Via dei Malabaila 1",,,"20th century",,,,"Blessed Virgin Mary (Our Lady of the Rosary)","Roman Catholic","Our Lady of the Rosary at Casetta Mattei",,,,,,,
5027,"Madonna del Rosario a Selva Nera","Largo Ines Bedeschi",,,"Late 20th century",,,,"Blessed Virgin Mary","Roman Catholic","Our Lady of the Rosary at Black Wood",,,,,,,
4654,"Madonna del Rosario a Via Laurentina","Via di Vallerano",,,"20th century",,,,"Blessed Virgin Mary (Our Lady of the Rosary)","Roman Catholic","Our Lady of the Rosary at the Radio Centre",,,,,,,
3584,"Madonna della Consolazione degli Agostiniani Recolletti","Viale dell'Astronomia 27",,,"20th century",,,,"Blessed Virgin Mary (Our Lady of Consolation)","Roman Catholic","Our Lady of Consolation of the Augustinian Recollects",,,,,,,
3585,"Madonna della Fiducia in Laterano","Piazza di San Giovanni in Laterano 4",,,"20th century",,,,"Blessed Virgin Mary","Roman Catholic","Our Lady of Trust at the Lateran",,,,,,,
4926,"Madonna della Strada","Via Paolo Ferrari 69",,,"20th century",,,,"Blessed Virgin Mary","Roman Catholic","St Mary of the Road",,,,,,,
3587,"Madonna delle Azalee","Via delle Azalee 148",,,"Mid 20th century",,,,"Blessed Virgin Mary","Roman Catholic","Our Lady of the Azaleas",,,,,,,
4985,"Madonna delle Grazie a Vigna Mangani",,,,,,,,"Blessed Virgin Mary (Our Lady of Graces)","Roman Catholic","Our Lady of Graces at the Mangani Vineyard",,,,,,,
3583,"Madonna dell’Orto a Porta Tiburtina","Viale di Porta Tiburtina 14",,,"20th century",,,,"Blessed Virgin Mary","Roman Catholic","Our Lady of the Garden at the Tiburtina Gate",,,,,,,
3416,"Madonna di Fatima alla Massimilla","Via Nicola Garrone 44",,,1979,,,,"Blessed Virgin Mary (Our Lady of Fatima)","Roman Catholic","Our Lady of Fatima at Massimilla",,,,,,,
3588,"Madonna di Fatima delle Suore Catechiste del Sacro Cuore","Via Giuseppe Cerbara 40",,,"20th century",,,,"Blessed Virgin Mary (Our Lady of Fatima)","Roman Catholic","Our Lady of Fatima of the Catechetical Sisters of the Sacred Heart",,,,,,,
4649,"Madonna di Guadalupe e San Francesco di Sales","Via Galla Placidia 63",,,1940,,,,"Blessed Virgin Mary St Francis de Sales","Roman Catholic","Our Lady of Guadalupe and St Francis of Sales",,,,,,,
4635,"Madonnella di San Marco","Palazzo Venezia, Piazza Venezia",,,"1455 (palazzo)",,,,"Blessed Virgin Mary","Roman Catholic","Little Madonna of St Mark",,,,,,,
3628,"Mysterium Fidei","Viale Tito Livio 24",,,1971,,,,"Holy Faith","Roman Catholic","Mystery of Faith",,,,,,,
3492,"Natività di Maria Santissima a Selva Candida","Via di Selva Candida 671",,,"Mid C20th century",,,,"Blessed Virgin Mary (Our Lady's Birthday)","Roman Catholic","Birthday of Holy Mary at the White Wood",,,,,,,
3491,"Natività di Maria a Bravetta","Via di Bravetta 633",,,2000,,,,"Blessed Virgin Mary (Our Lady's Birthday)","Roman Catholic","Birthday of Mary at Bravetta",,,,,,,
3629,"Natività di Nostro Signore Gesù Cristo a Casal Morena","Via Anagnina 396",,,"17th century",,,,"Jesus Christ (Nativity)","Roman Catholic","Nativity of Our Lord Jesus Christ at Morena Farm",,,,,,Deconsecrated,
3494,"Natività di Nostro Signore Gesù Cristo a Via Gallia","Via Urbisgalia 2",,,1932,,,,"Jesus Christ (Nativity)","Roman Catholic","Birthday of Our Lord Jesus Christ on Gallian Way",,,,,,,
3493,"Natività di Nostro Signore Gesù Cristo degli Agonizzanti","Vicolo dei Granari 10/A (off Piazza Pasquino)",,,"17th century",,,,"Jesus Christ (Nativity)","Roman Catholic","Birthday of Our Lord Jesus Christ of the Strugglers",,,,,,,
3503,"Nostra Signora de La Salette","Piazza Madonna de La Salette",,,"Early 20th century (1st), 1965 (2nd)",,,,"Blessed Virgin Mary (Our Lady of La Salette)","Roman Catholic","Our Lady of La Salette",,,,,,,
3632,"Nostra Signora del Carmelo dei Mercedari","Via Monte Carmelo 3",,,"1980's",,,,"Blessed Virgin Mary","Roman Catholic","Our Lady of Carmel of the Mercedarians",,,,,,,
3633,"Nostra Signora del Pilar dei Marianisti","Via Latina 22",,,"20th century",,,,"Blessed Virgin Mary","Roman Catholic","Our Lady of the Pillar of the Marianists",,,,,,,
2097,"Nostra Signora del Sacro Cuore","Corso del Rinascimento 27  00186 Roma",,,"C. 1450",,,,"Blessed Virgin Mary","Roman Catholic","Our Lady of the Sacred Heart",,,,"06 68 75 214",,,
4933,"Nostra Signora del Sacro Cuore a Mazzalupo","Via Dronero 9",,,"Mid 20th century",,,,"Blessed Virgin Mary","Roman Catholic","Our Lady of the Sacred Heart at Mazzalupo",,,,,,,
4932,"Nostra Signora del Sacro Cuore a Piazza Navona","Corso del Rinascimento 27  00186 Roma",,,c1450,,,,"Blessed Virgin Mary","Roman Catholic","Our Lady of the Sacred Heart at Piazza Navona",,,,"06 68 75 214",,,
4928,"Nostra Signora del Sacro Cuore al Portuense","Via Alessandro Brisse 22",,,"20th century",,,,"Blessed Virgin Mary","Roman Catholic","Our Lady of the Sacred Heart at Portuense",,,,,,,
3636,"Nostra Signora del Sacro Rosario delle Suore Betlemite","Via Lambro 12",,,"20th century",,,,"Blessed Virgin Mary","Roman Catholic","Our Lady of the Holy Rosary of the Bethlehemite Sisters",,,,,,,
1438,"Nostra Signora del Santissimo Sacramento e Santi Martiri Canadesi","46 Via Giovanni Battista de Rossi 00161 Roma","Bruno Apollini Ghetti","<nowiki>Francesco Nagni, Angelo Biancini</nowiki>",1955,,"Priests of the Most Holy Sacrament",,"Blessed Virgin Mary","Roman Catholic","Our Lady of the Most Holy Sacrament and the Canadian Martyrs",,,,"06 44 23 79 84","Vacant (2015)","Parish church",
3117,"Nostra Signora del Suffragio e San Agostino di Canterbury","Via Walter Tobagi 133",,,1998,,,,"Blessed Virgin Mary (Our Lady of Suffrage), Augustine of Canterbury","Roman Catholic","Our Lady of Suffrage and St Augustine of Canterbury",,,,,,,
3504,"Nostra Signora di Bonaria","Via Nostra Signora di Bonaria",,,1982,,,,"Blessed Virgin Mary (Our Lady of Bonaria)","Roman Catholic","Our Lady of Bonaria (which is a place in Sardinia)",,,,,,,
3505,"Nostra Signora di Coromoto","Largo Nostra Signora di Coromoto",,,1978,,,,"Blessed Virgin Mary (Our Lady of Coromoto)","Roman Catholic","Our Lady of Coromoto (which is a place in Venezuela)",,,,,,,
3506,"Nostra Signora di Czestochowa","Largo Augusto Corelli 9",,,1971,,,,"Blessed Virgin Mary (Our Lady of Czestochowa)","Roman Catholic","Our Lady of Czestochowa (which is a place in Poland)",,,,,,,
3377,"Nostra Signora di Fatima a San Vittorino","Via Ponte Terra, San Vittorino",,,1979,,,,"Blessed Virgin Mary","Roman Catholic","Our Lady of Fatima at St Victor",,,,,,,
3508,"Nostra Signora di Fatima ad Ottavia","Via del Fontanile Nuovo 88",,,1975,,,,"Blessed Virgin Mary (Our Lady of Fatima)","Roman Catholic","Our Lady of Fatima at Octavia",,,,,,,
3502,"Nostra Signora di Guadalupe a Monte Mario","Piazza Nostra Signora di Guadalupe 12",,,1932,,,,"Blessed Virgin Mary (Our Lady of Guadalupe)","Roman Catholic","Our Lady of Guadalupe at Mount Marius",,,,,,,
4788,"Nostra Signora di Guadalupe e San Filippo Martire in Via Aurelia","675 Via Aurelia","Gianni Mazzocca",,1958,,"Legion of Christ",,"Blessed Virgin Mary and St Philip the Apostle","Roman Catholic","Our Lady of Guadalupe and St Philip Martyr in Via Aurelia",,,"Mexico and Latin America",,"Juan Sandoval Iñiguez","National church",
3507,"Nostra Signora di Lourdes a Tor Marancia","Via Andrea Mantegna 147",,,1958,,,,"Blessed Virgin Mary (Our Lady of Lourdes)","Roman Catholic","Our Lady of Lourdes at Marancia Tower",,,,,,,
3640,"Nostra Signora di Lourdes a Torrevecchia","Via Cristoforo Numai 15",,,"20th century",,,,"Blessed Virgin Mary","Roman Catholic","Our Lady of Lourdes at the Old Tower",,,,,,,
3509,"Nostra Signora di Valme","Via di Vigna Due Torri 82",,,1996,,,,"Blessed Virgin Mary (Our Lady of Valme)","Roman Catholic","Our Lady of Valme",,,,,,,
3641,"Nostro Signore Gesù Cristo Divino Maestro","Via Portuense 741",,,"1960's",,,,"Jesus Christ","Roman Catholic","Our Lord Jesus Christ the Divine Master",,,,,,,
3644,Ognissanti,"Via Appia Nuova 244",,,1920,,,,"All Saints","Roman Catholic","All Saints",,,,,,,
4072,"Oratorio al Monte di Giustizia","Stazione Termini, buried under main building",,,"4th century",,,,Agatha?,"Roman Catholic?","Oratory on the Hill of Justice",,,,,,"Deconsecrated and ruined",
2100,"Oratorio dei Quaranta Martiri","Largo Romolo e Remo ''Forum Romanum archaeological site''",,,"8th century (church), 1st century (building)",,,,"Forty Martyrs of Sebaste","Roman Catholic","Oratory of the Forty Martyrs",,"Mariaantiqua front01.jpg",,,,Oratory,
2102,"Oratorio del Gonfalone","Via del Gonfalone 32A",,,1544-7,,,,"Peter and Paul","Roman Catholic","Oratory of the Gonfalone",,,,,,Oratory,
2101,"Oratorio del Santissimo Crocifisso","69 Piazza dell'Oratorio 00187 Roma","Giacomo della Porta",,1568,,,,"The Holy Cross","Roman Catholic","Oratory of the Most Holy Crucifix","06 67 97 017",,,"06 67 97 017",,,
4632,"Oratorio dell'Angelo Custode","11 Piazza Poli","Carlo Rainaldi",,1730,,,,"Guardian Angel","Roman Catholic","Oratory of the Guardian Angel",,,,,,Oratory,
4224,"Oratorio della Via Crucis nel Foro Romano","Roman Forum (right of Temple of Romulus)",,,"18th century",,,,,"Roman Catholic","Oratory of the Way of the Cross in the Roman Forum",,,,,,,
4958,"Oratorio di Beato Giacomo Cusmano","Via di Torre Gaia 120",,,"20th century",,,,"James Cusmano","Roman Catholic","Blessed James Cusmano, Oratory of",,,,,,,
4542,"Oratorio di San Cesareo in Palatio","Domus Augustana, Palatine",,,"9th century",,,,"St Caesarius","Roman Catholic","Oratory of St Caesarius on the Palatine",,,,,,Demolished,
4562,"Oratorio di Vicolo del Cedro","Vicolo del Cedro, near junction with Via del Mattonato",,,"18th century",,,,?,"Roman Catholic","Oratory of the Alley of the Citron Tree",,,,,,Deconsecrated,
3792,"Ostia, Basilica Constantiniana","Via del Sabazeo, south end, Ostia",,,c330,,,,"Peter, Paul and John the Baptist","Roman Catholic","Ostia, Constantinian Basilica",,,,,,Ruined,
3791,"Ostia, Basilica di Pianabella","Via di Piana Bella (up rough track, by railway)",,,,,,,Unknown,"Roman Catholic","Ostia, Basilica of the Beautiful Plain",,,,,,Ruined,
3793,"Ostia, Oratorio Cristiana delle Terme di Mitra","Via della Foce, Ostia",,,c400,,,,Unknown,"Roman Catholic","Ostia, Christian Oratory at the Baths of Mithras",,,,,,,
3796,"Ostia, Oratorio di San Quiriaco","South-east of the theatre, Ostia Antica",,,"About 400",,,,"Quiriacus of Ostia","Roman Catholic","Ostia, Oratory of St Quiriacus",,,,,,,
4791,"Preziosissimo Sangue di Nostro Signore Gesù Cristo a Tor di Quinto","Via Flaminia 732/T",,,1957,,,,"Jesus (Precious Blood)","Roman Catholic","Precious Blood of Our Lord Jesus Christ at Tower of Five",,,,,,,
4792,"Preziosissimo Sangue di Nostro Signore Gesù Cristo ad Appio Latino","Via Beata Maria De Mattias 10",,,1937,,,,"Jesus Christ (Precious Blood)","Roman Catholic","Precious Blood of our Lord Jesus Christ at Appio Latino",,,,,,,
4793,"Preziosissimo Sangue di Nostro Signore Gesù Cristo al Laterano","Via di San Giovanni in Laterano 73",,,"Mid 19th century",,,,"Jesus Christ (Precious Blood)","Roman Catholic","Precious Blood of our Lord Jesus Christ at the Lateran",,,,,,,
3653,"Preziosissimo Sangue di Nostro Signore Gesù Cristo dei Missioni Estere","Via Francesco Domenico Guerrazzi 11",,,"20th century",,,,"Jesus Christ (Precious Blood)","Roman Catholic","Precious Blood of Our Lord Jesus Christ of the Foreign Missions",,,,,,,
3655,"Purificazione di Santa Maria","Via Lucio Sestio 1",,,"20th century",,,,"Blessed Virgin Mary","Roman Catholic","Purification of St Mary",,,,,,,
3705,"Re Magi","Collegio di Propaganda Fidei, Via Gregoriana",,,1644,,,,Magi,"Roman Catholic","Kings Magi",,,,,,,
3711,"Resurrezione de Nostro Signore Gesù Cristo dei Polacchi","Via di San Sebastianello 11",,,1889,,,,"Jesus Christ","Roman Catholic","Resurrection of our Lord Jesus Christ of the Poles",,,,,,,
3709,"Resurrezione di Nostro Signore Gesù Cristo a Giardinetti","Via degli Orafi 120",,,1963,,,,"Jesus (Resurrection)","Roman Catholic","Resurrection of Our Lord Jesus Christ at the Little Garden",,,,,,,
3657,"Resurrezione di Nostro Signore Gesù Cristo a Via Prenestina","Largo Anacapri 11",,,"20th century",,,,"Jesus Christ","Roman Catholic","Resurrection of Our Lord Jesus Christ on the Prenestina Way",,,,,,,
3190,"Sacra Famiglia a Via Portuense","Via Filippo Tajani 10",,,1978,,,,"Holy Family","Roman Catholic","Holy Family on the Portuensian Way",,,,,,,
3890,"Sacra Famiglia a Via Sommacampagna","Via Sommacampagna",,,1896,,,,"Holy Family","Roman Catholic","Holy Family at Sommacampagna Way",,,,,,Demolished,
3191,"Sacra Famiglia a Villa Troili","Via di Villa Troili 48",,,1957,,,,"Holy Family","Roman Catholic","Holy Family at Troili Villa",,,,,,,
3293,"Sacra Famiglia alla Garbatella","Via David Salinieri 5",,,"20th century",,,,"Holy Family","Roman Catholic","Holy Family at Garbatella",,,,,,,
3193,"Sacra Famiglia di Nazareth a Centocelle","Piazzale delle Gardenie 45",,,1972,,,,"Holy Family","Roman Catholic","Holy Family of Nazareth at Centocelle",,,,,,,
3192,"Sacra Famiglia di Nazareth all'Esquilino","Via Machiavelli 18",,,"Early 20th century",,,,"Holy Family","Roman Catholic","Holy Family of Nazareth on the Esquiline",,,,,,,
3177,"Sacri Cuori di Gesù e Maria","Via Poggio Moiano 12",,,1957,,,,"Sacred Heart of Jesus and Immaculate Heart of Mary","Roman Catholic","Sacred Hearts of Jesus and Mary",,,,,,,
3408,"Sacri Cuori di Gesù e Maria di Porto Santa Rufina","Via del Cenacolo 45, La Storta",,,1950,,,,"Hearts of Jesus and Mary","Roman Catholic","Sacred Hearts of Jesus and Mary of Port St Rufina",,,,,,,
1967,"Sacro Cuore Immacolato di Maria","Piazza Euclide 5 00197 Roma","Amando Brasini",,"Early 20th century",,,"1 May 1959","Blessed Virgin Mary","Roman Catholic","Sacred Immaculate Heart of Mary",,,,"06 80 70 359",1965&ndash;,,
1969,"Sacro Cuore del Suffragio","12 Lungotevere Prati  00193 Roma","Giuseppe Gualandi",,1894,,"Missionaries of the Sacred Heart","1 November 1917","Sacred Heart of Jesus","Roman Catholic Church","Sacred Heart of Suffrage","06 68 695 261",,,"06 68 80 65 17",,,
