cid,name,address,architect,artists,built,caption,clergy,consecrated,dedication,denomination,englishname,fax,image,national,phone,titular,type,url
3466,"Santa Maria Regina Pacis a Monte Verde","Via Maurizio Quadrio 21",,,1932,,,,"Blessed Virgin Mary","Roman Catholic","St Mary, Queen of Peace at Green Mountain",,,,,,,
3467,"Santa Maria Regina Pacis a Ostia Lido","Piazza Regina Pacis 13",,,1928,,,,"Blessed Virgin Mary","Roman Catholic","St Mary, Queen of Peace at the Ostia Lido",,,,,,,
2045,"Santa Maria Regina degli Apostoli alla Montagnola","75 Via Antonino Pio  00145 Roma","Leo Favini",,1945-54,,,"November 1954","Blessed Virgin Mary","Roman Catholic Church","Our Lady Queen of the Apostles at Montagnola",,,,"06 59 60 27 16","Cardinal Noè","Titular church, Minor basilica","http://www.sanpaolo.org/reginapostoli/ website"
3464,"Santa Maria Regina dei Cuori","Via Romagna 44",,,1913,,,,"Blessed Virgin Mary","Roman Catholic","St Mary, Queen of Hearts",,,,,,,
3465,"Santa Maria Regina dei Martiri in Via Ostiense","Via Carlo Casini 282",,,1968,,,,"Blessed Virgin Mary","Roman Catholic","St Mary, Queen of Martyrs on the Ostian Way",,,,,,,
4629,"Santa Maria Regina dei Minori","Via Piemonte 70 (entrance on Via Sardegna)",,,1904,,,,"Blessed Virgin Mary","Roman Catholic","St Mary, Queen of the Minors",,,,,,,
3374,"Santa Maria Regina della Pace a Tor Vergata","Via di Tor Vergata 309",,,"2008, rebuilt 2016",,,,"Blessed Virgin Mary","Roman Catholic","St Mary, Queen of Peace at Tor Vergata",,,,,,,
3622,"Santa Maria Rosa Molas","Via Cervino 6",,,"20th century",,,,"Maria-Rosa Molas y Vallvé","Roman Catholic","St Mary-Rose Molas",,,,,,,
2084,"Santa Maria Scala Coeli","Via Laurentina 473   00142 Roma","Giacomo della Porta","Francesco Zucca",1538,,,,"Blessed Virgin Mary",,"Our Lady (the) Stairway to Heaven",,,,"06 54 01 655",,,
4467,"Santa Maria Sotto L'Arco","Aula Paolo VI, Vatican City",,,,,,,"Blessed Virgin Mary","Roman Catholic","St Mary Under the Arch",,,,,,Demolished,
5022,"Santa Maria Stella Maris a Castel Palocco","Viale dei Promontori 113",,,1977,,,,"Blessed Virgin Mary","Roman Catholic","St Mary, Star of the Sea",,,,,,,
3624,"Santa Maria Stella Maris a Mostacciano","Via Sergio De Vitis 100",,,"20th century",,,,"Blessed Virgin Mary","Roman Catholic","St Mary, Star of the Sea at Mostacciano",,,,,,,
3471,"Santa Maria Stella Matutina","Via Lucilio 2",,,1951,,,,"Blessed Virgin Mary","Roman Catholic","St Mary, Morning Star",,,,,,,
3469,"Santa Maria Stella dell’Evangelizzazione","Via Amsterdam 5",,,2006,,,,"Blessed Virgin Mary","Roman Catholic","St Mary, Star of Evangelization",,,,,,,
3379,"Santa Maria a San Vittorino","Via di San Vittorino",,,1703,,,,"Blessed Virgin Mary","Roman Catholic","St Mary at St Victorinus",,,,,,,
3096,"Santa Maria a Setteville","Via Ludovico Muratori, 00010 Setteville di Guidonia",,,2000,,,,"Blessed Virgin Mary","Roman Catholic","Mary at Setteville",,,,,,,
4947,"Santa Maria ad Magos","Via Ardeatina, junction with Via dei Casali di Porta Medaglia",,,"15th century",,,,"Blessed Virgin Mary","Roman Catholic","St Mary at the Magician's",,,,,,,
2059,"Santa Maria ad Martyres","Piazza della Rotonda 12 00186 Roma",,"Alessandro Specchi, Bernardino Cametti, Vincenzo de Rossi et al.","27 BC",,,"c. 608","Blessed Virgin Mary","Roman Catholic Church","Our Lady and the Martyrs (Pantheon)",,,,"06 68 30 02 30",,,
4994,"Santa Maria ad Nives a Salone","Via Andrea Noale",,,"16th century",,,,"Blessed Virgin Mary (Our Lady of the Snows)","Roman Catholic","St Mary of the Snow at Salone",,,,,,,
4709,"Santa Maria ai Monti","41 Via della Madonna del Monti  00184 Roma","Giacomo della Porta, Carlo Lombardi, Flaminio Ponzi","Cristoforo Casolani, Giacinto Gimignani, Giovanni Anguilla et al.",1580,,Diocesan,,"Blessed Virgin Mary","Roman Catholic Church","Our Lady of the Hills",,,,"06 48 55 31","Cardinal Urosa Savino",,
2020,"Santa Maria degli Angeli","9 Via Cernale (Piazza della Repubblica) 00185 Roma","Michelangelo Buonarroti, Jacopo Lo Duca",,"From 1563",,Diocesean,,,,"Our Lady of the Angels and the Martyrs",,,,"06 48 80 812",Yes,"Parish church",
4585,"Santa Maria degli Angeli all'Aeroporto di Fiumicino","Via dell'Aeroporto di Fiumicino 321, Fiumicino",,,"20th century",,,,"Blessed Virgin Mary (Our Lady, Queen of the Angels)","Roman Catholic","St Mary of the Angels at the Airport of Fiumicino",,,,,,,
3318,"Santa Maria dei Cerchi","Via dei Cerchi",,,"17th century","The apse of the demolished church.",,,"Blessed Virgin Mary","Roman Catholic","St Mary of the Circus",,SMdCerchi.JPG,,,,Demolished,
3319,"Santa Maria dei Foglianti","Via Rasella",,,1629,,,,"Blessed Virgin Mary","Roman Catholic","St Mary of the Foglianti",,,,,,,
2068,"Santa Maria dei Miracoli","528 Via del Corso / Piazza del Popolo 00187 Roma","Carlo Rainaldi, Gian Lorenzo Bernini, Carlo Fontana",,1597,,"Priests of the Sacred Heart",,"Blessed Virgin Mary","Roman Catholic Church","Our Lady of Miracles",,,,"06 36 10 250",,,
3320,"Santa Maria dei Pellegrini e Sant’Aristide","Via Bernardo Pasquini 34",,,"20th century",,,,"Blessed Virgin Mary and Aristides the Apologist","Roman Catholic","SS Mary of the Pilgrims and Aristides",,,,,,,
2085,"Santa Maria dei Sette Dolori","Via Garibaldi 27   00153 Roma",Borromini,,1662,,,,"Blessed Virgin Mary","Roman Catholic Church","Our Lady of the Seven Griefs",,Maria_dei_Sette_Dolori.jpg,,"06 58 97 327",,,
3321,"Santa Maria del Buon Aiuto nell’ Anfiteatro Castrense","Piazza Santa Croce",,,1476,,,,"Blessed Virgin Mary","Roman Catholic","St Mary of Good Help in the Amphitheatre of the Military Camp",,,,,,,
3322,"Santa Maria del Buon Consiglio a Porta Furba","Via Tuscolana 613",,,1916,,,,"Blessed Virgin Mary (Our Lady of Good Counsel)","Roman Catholic","St Mary of Good Counsel at Furba Port",,,,,,,
4728,"Santa Maria del Buon Consiglio a Tor de' Conti","Via di Tor de'Conti",,,"19th century",,,,"Blessed Virgin Mary","Roman Catholic","St Mary of Good Counsel at the Cricket Entrance",,,,,,,
3324,"Santa Maria del Buon Consiglio ai Monti","Via del Buon Consiglio 19",,,Mediaeval,,,,"Blessed Virgin Mary","Roman Catholic","St Mary of Good Counsel at Monti",,,,,,Deconsecrated,
3330,"Santa Maria del Buon Riposo in Via Portuense","Via Portuense",,,"17th century",,,,"Blessed Virgin Mary","Roman Catholic","St Mary of Good Repose at Via Portuense",,,,,,Deconsecrated,
3326,"Santa Maria del Buon Viaggio","Via del Porto di Ripa Grande 8",,,"End 17th century",,,,"Blessed Virgin Mary","Roman Catholic","St Mary of the Good Voyage",,,,,,,
3327,"Santa Maria del Carmelo a Mostacciano","Piazza Beata Vergine del Carmelo 10",,,1986,,,,"Blessed Virgin Mary (Our Lady of Carmel)","Roman Catholic","St Mary of Carmel at Mostacciano",,,,,,,
2053,"Santa Maria del Carmine alle Tre Cannelle","4 Via del Carmine 00187 Roma","Michelangelo Specchi","Gaspare Celio, Sebastiano Conca, Giovanni Pirri","1605 - 1750",,Diocesan,,"Blessed Virgin Mary","Roman Catholic Church","Our Lady of Mount Carmel at Tre Cannelle",,,,"06 67 81 161",,,
3328,"Santa Maria del Carmine e San Giuseppe al Casaletto","Via del Casaletto 691",,,"1773, 1853, 1933 (three churches)",,,,"Blessed Virgin Mary (Our Lady of Carmel) and Joseph","Roman Catholic","St Mary of Carmel and St Joseph at Casaletto",,,,,,,
4452,"Santa Maria del Carmine e Sant'Antonio","Via del Teatro di Marcello (north end)",,,,,,,"Blessed Virgin Mary and Anthony of Padua","Roman Catholic","St Mary of Carmel and St Anthony",,,,,,Demolished,
3384,"Santa Maria del Carmine e del Monte Libano","Vicolo dei Costaguti",,,1759,,,,"Blessed Virgin Mary (Our Lady of Mount Carmel)","Roman Catholic","St Mary of Carmel and of Mount Lebanon",,,,,,Deconsecrated,
4454,"Santa Maria del Carmine in Trastevere","Viale di Trastevere (opposite San Crisogono)",,,"17th century",,,,"Blessed Virgin Mary","Roman Catholic","St Mary of Carmel in Trastevere",,,,,,"Deconsecrated and demolished",
4586,"Santa Maria del Divino Amore","12 Vicolo del Divino Amore 00186 Roma","Filippo Raguzzini",,"12th century, rebuilt 1729","Exterior of Chiesa del Divino Amore",,,"Blessed Virgin Mary","Roman Catholic","Our Lady of Divine Love",,Divinoamore.JPG,,"06 67 94 612 06 68 73 640",,"Confraternity church",
1519,"Santa Maria del Pianto","20 Via Santa Maria dei Calderari",,,1616,,,,"Blessed Virgin Mary","Roman Catholic","Our Lady of Grief",,,No,,No,,
3332,"Santa Maria del Ponte e San Giuseppe","Via Albi 89",,,"Late 20th century",,,,"Blessed Virgin Mary, Joseph","Roman Catholic","St Mary of the Bridge and St Joseph",,,,,,,
2079,"Santa Maria del Popolo","12 Piazza del Popolo 00187 Roma","Baccio Pontelli, Gian Lorenzo Bernini","<nowiki>Raphael, Lorenzetto,Luigi de Pace. Caravaggio et.al.</nowiki>","1099, rebuilt 1472&ndash;1479",,"Augustinian friars",,"Blessed Virgin Mary","Roman Catholic Church","Our Lady of the People",,Maria_del_Popolo.jpg,,"06 36 10 836","Stanislaw Dziwisz","Minor basilica",
2081,"Santa Maria del Priorato","Piazza dei Cavalieri di Malta","Giovanni Battista Piranesi","Paolo Romano","18th century",,,,"Blessed Virgin Mary","Roman Catholic Church","Our Lady of the Priory",,,,,,,
4832,"Santa Maria del Riposo","Via Aurelia 327",,,"Early 16th century",,,,"Blessed Virgin Mary","Roman Catholic","St Mary of Rest",,,,,,,
3333,"Santa Maria del Ritiro al Gianicolo","Via San Francesco di Sales 25",,,"Early 20th century",,,,"Blessed Virgin Mary","Roman Catholic","St Mary of the Retreat on the Janiculum",,,,,,,
3334,"Santa Maria del Rosario a Monte Mario","Via Trionfale 175",,,1726,,,,"Blessed Virgin Mary (Our Lady of the Rosary)","Roman Catholic","St Mary of the Rosary on Mount Marius",,,,,,,
3335,"Santa Maria del Rosario ai Martiri Portuensi","Via Chiusdino 16",,,2007,,,,"Blessed Virgin Mary (Our Lady of the Rosary), Portuensian Martyrs","Roman Catholic","St Mary of the Rosary and the Portuensian Martyrs",,,,,,,
3336,"Santa Maria del Rosario della Divina Provvidenza","Via di Ripetta 231",,,"18th century",,,,"Blessed Virgin Mary","Roman Catholic","St Mary of the Rosary of Divine Providence",,,,,,Deconsecrated,
3889,"Santa Maria del Rosario di Pompei alla Magliana","Piazza della Madonna di Pompei",,,1915,,,,"Blessed Virgin Mary (Our Lady of Pompeii)","Roman Catholic","St Mary of the Rosary at Magliana",,,,,,,
3337,"Santa Maria del Rosario di Pompeii alla Magliana",,,,1915,,,,"Blessed Virgin Mary (Our Lady of the Rosary)","Roman Catholic","St Mary of the Rosary of Pompeii at Magliana",,,,,,,
4600,"Santa Maria del Rosario e San Pietro Chanel","Via Cernaia 14/B",,,1898,,,,"Blessed Virgin Mary (Our Lady of the Rosary), St Peter Chanel","Roman Catholic","St Mary of the Rosary and St Peter Chanel",,SMRosarioPompei.jpg,,,,,
3338,"Santa Maria del Rosario in Prati","Via Germanico 94",,,1916,,,,"Blessed Virgin Mary (Our Lady of the Rosary)","Roman Catholic","St Mary of the Rosary in the Meadows",,,,,,,
4466,"Santa Maria del Rosario nel Castello","Castel Sant'Angelo",,,,,,,"Blessed Virgin Mary","Roman Catholic","St Mary of the Rosary in the Castle",,,,,,Demolished,
4418,"Santa Maria del Rosario nel Cimitero di Santo Spirito","Via Urbano VIII (north end)",,,"18th century",,,,"Blessed Virgin Mary (Our Lady of the Rosary)","Roman Catholic","St Mary of the Rosary in the Cemetery of the Holy Spirit",,,,,,"Deconsecrated and demolished",
3600,"Santa Maria del Servizio alla Borgata del Podere Buccari","Via Usseglio 44",,,"20th century",,,,"Blessed Virgin Mary","Roman Catholic","St Mary of Service at the Hamlet of Buccari Farm",,,,,,,
3339,"Santa Maria del Soccorso","Via del Badile 1",,,1938,,,,"Blessed Virgin Mary","Roman Catholic","Our Lady of Help",,,,,,,
3113,"Santa Maria del Soccorso al Monte di Pietà","Piazza del Monte di Pietà 32",,,1696,,,,"Blessed Virgin Mary","Roman Catholic","St Mary of Help at the Mountain of Piety",,,,,,,
3340,"Santa Maria del Soccorso e San Filippo Neri a Castelporziano","Village of Castel Porziano",,,"Early 16th century? 19th century",,,,"Blessed Virgin Mary, Philip Neri","Roman Catholic","St Mary of Help and St Philip Neri at Porziano Castle",,,,,,,
3108,"Santa Maria del Sole","Piazza Bocca della Verità",,,"About 100 BC (temple), 12th century (church)",,,,"Blessed Virgin Mary","Roman Catholic","St Mary of the Sun",,,,,,Deconsecrated,
3341,"Santa Maria del Suffragio","Via Giulia 59a",,,1669,,,,"Blessed Virgin Mary","Roman Catholic","St Mary of Suffrage",,,,,,,
4647,"Santa Maria del Terzo Millennio alle Tre Fontane","Via Laurentina 450",,,1956,,,,"Blessed Virgin Mary (Our Lady of Revelation)","Roman Catholic","St Mary of the Third Millennium at the Three Fountains",,,,,,,
2044,"Santa Maria dell'Anima","Via Santa Maria dell'Anima 64",,,1500,,,,"Blessed Virgin Mary","Roman Catholic","St Mary of the Souls",,,,,,,
2049,"Santa Maria dell'Archetto","Via di San Marcello 41  00187 Roma","Virginio Vespagniani Constantino Brumidi","Luigi Simonetti",1851,,,,"Blessed Virgin Mary","Roman Catholic Church","Our Lady of the Bow",,,,,,,
4497,"Santa Maria dell'Arco Oscuro","Via delle Belle Arti",,,1797,,,,"Blessed Virgin Mary","Roman Catholic","St Mary at the Dark Arch",,,,,,,
4450,"Santa Maria dell'Arco in un Torrione","Viale Giotto",,,,,,,"Blessed Virgin Mary","Roman Catholic","St Mary of the Arch in a Tower",,,,,,,
4498,"Santa Maria dell'Assunzione al Collegio Clementino","Piazza Nicosia",,,"17th century",,,,"Blessed Virgin Mary, Assumption","Roman Catholic","St Mary of the Assumption at the Clementine College",,,,,,"Deconsecrated and demolished",
4677,"Santa Maria dell'Orazione e Morte",,"Fernando Fuga",,"1576, rebuilt 1732 to 1737.",,,,"Blessed Virgin Mary","Roman Catholic Church","Our Lady of Eulogies and of the Dead",,,,,,,
1564,"Santa Maria dell'Orto","10, Via Anicia - 00153 Rome","Giulio Romano, Guidetto Guidetti, Jacopo Barozzi","Giovanni Baglione, Federico Zuccari, Taddeo Zuccari",1530&ndash;1579,,,,"Blessed Virgin Mary","Roman Catholic","St Mary in the Garden",,,,00390658301874,,,
2087,"Santa Maria dell'Umiltà","30 Via dell'Umiltà 00187 Roma","<nowiki>Paolo Marucelli, Carlo Fontana</nowiki>","Vincenzo Felici, Francesco Cavallini, Antonio Raggi",1641-1646,,,,"Blessed Virgin Mary","Roman Catholic Church","Our Lady of Humility",,,,"06 67 89 184   06 69 00 11",,,
3345,"Santa Maria della Clemenza a Trastevere","Vicolo del Piede 14",,,"Early 17th century",,,,"Blessed Virgin Mary","Roman Catholic","St Mary of Clemency in Trastevere",,,,,,Deconsecrated,
4457,"Santa Maria della Concezione alla Lungara","Via della Lungara (near Ponte G. Mazzini)",,,1723,,,,"Blessed Virgin Mary (Immaculate Conception)","Roman Catholic","St Mary of the (Immaculate) Conception at the Lungara",,,,,,Demolished,
2022,"Santa Maria della Concezione dei Cappuccini","27 Via Veneto  00187 Roma","Antonio Casoni","Domenichino, Gherardo delle Notti, Guido Reni et al.","1626 to 1631",,"Friars Minor Capuchin",,"Blessed Virgin Mary","Roman Catholic Church","Our Lady of the Conception of the Capuchins",,,,"06 45 28 50",,,"http://www.cappucciniviaveneto.it/ Official site"
4475,"Santa Maria della Concezione dei Sacconi Turchini","Via della Madonna dei Monti",,,"17th century",,,,"Blessed Virgin Mary (Immaculate Conception)","Roman Catholic","St Mary of the (Immaculate) Conception of the Turquoise Mantles",,,,,,Demolished,
4917,"Santa Maria della Concezione delle Farnesiane","Via Cavour (in roadway west of Via degli Annibaldi)",,,"17th century",,,,"Blessed Virgin Mary","Roman Catholic","St Mary of the Conception of the Farnesian Nuns",,,,,,Demolished,
3390,"Santa Maria della Concezione delle Viperesche","Via San Vito",,,c1690,,,,"Blessed Virgin Mary","Roman Catholic","St Mary of the Conception of the Viperesche nuns",,,,,,,
4472,"Santa Maria della Concezione in Vaticano","Palazzo San Carlo, Vatican City",,,,,,,"Blessed Virgin Mary, Immaculate Conception","Roman Catholic","St Mary of the (Immaculate) Conception in the Vatican",,,,,,,
3348,"Santa Maria della Consolazione a Piazza Ottavilla","Piazza Ottavilla 1",,,"20th century",,,,"Blessed Virgin Mary","Roman Catholic","St Mary of Consolation at Ottavilla Square",,,,,,,
3346,"Santa Maria della Consolazione a Tre Pini Poggio dei Fiori","Via Aldo della Rocca 6",,,1983,,,,"Blessed Virgin Mary (Our Lady of Consolation)","Roman Catholic","St Mary of Consolation at the Three Pines (on the) Hillock of Flowers",,,,,,,
5004,"Santa Maria della Consolazione al Foro Romano","94 Piazza della Consolazione<BR>00186 Rome",,,,,,,"Blessed Virgin Mary","Roman Catholic Church","Our Lady of Consolation",,,,06-67.84.654,,,
3349,"Santa Maria della Divina Provvidenza a Testaccio","Via Alessandro Volta",,,1889,,,,"Blessed Virgin Mary (Our Lady of Divine Providence)","Roman Catholic","St Mary of Divine Providence in Testaccio",,,,,,,
4470,"Santa Maria della Febbre (including Santa Petronilla)","Sacristy, St Peter's, Vatican City",,,"c. 200",,,,"Blessed Virgin Mary, Petronilla, Michael the Archangel","Roman Catholic","St Mary of the Fever; St Petronilla; St Michael at the Vatican",,,,,,,
3350,"Santa Maria della Fiducia","Via Casilina 1837",,,1954,,,,"Blessed Virgin Mary","Roman Catholic","St Mary of Trust",,,,,,,
2058,"Santa Maria della Luce","Via della Luce/Via della Lungaretta 22/A  00153 Roma","Gabrieli Valvassari",,,,,,"Blessed Virgin Mary","Roman Catholic Church","Our Lady of the Light",,,,"06 58 00 820",,,
3367,"Santa Maria della Mercede e Sant'Adriano","Via Basento 100",,,1958,,,,"Blessed Virgin Mary (Our Lady of Mercy), Hadrian of Nicomedia","Roman Catholic","St Mary of Mercy and St Hadrian",,,,,,,
4689,"Santa Maria della Misericordia al Verano","Quadriporticus, Cimiterio del Verano",,,1880,,,,,"Roman Catholic","Church at the Verano Cemetery",,,,,,,
3365,"Santa Maria della Neve al Colosseo","Via del Colosseo 18",,,"Early 17th century",,,,"Blessed Virgin Mary","Roman Catholic","St Mary of the Snow at the Colosseum",,,,,,,
2076,"Santa Maria della Pace","Piazza Santa Maria della Pace / 5 Vicolo del Arco della Pace","Baccio Pontelli, Pietro da Cortona","Carlo Maderno, Raphael",,,,,"Blessed Virgin Mary","Roman Catholic Church","Our Lady of Peace",,,,,,,
3351,"Santa Maria della Perseveranza","Via della Pisana 95",,,1964,,,,"Blessed Virgin Mary","Roman Catholic","St Mary of Perseverance",,,,,,,
3101,"Santa Maria della Pietà al Colosseo",Colosseum,,,"AD 80 (Colosseum), 1519 (chapel, now demolished)",,,,"Blessed Virgin Mary","Roman Catholic","St Mary of Piety in the Colosseum",,,,,,,
5007,"Santa Maria della Pietà in Camposanto Teutonico","Piazza del S. Uffizio (Camposanto Teutonico) 00193 Roma (C. di Vaticano)",,,1450,,,,"Blessed Virgin Mary","Roman Catholic Church","Our Lady of Mercy in the German Cemetery",,,,,,,
4929,"Santa Maria della Presentazione a Torrevecchia","Via di Torrevecchia 1104",,,2001,,,,"Blessed Virgin Mary (Presentation)","Roman Catholic","St Mary of the Presentation at the Old Tower",,,,,,,
4931,"Santa Maria della Presentazione al Quartaccio","Via Thomas Mann 20",,,2002,,,,"Blessed Virgin Mary (Presentation)","Roman Catholic","St Mary of the Presentation at Quartaccio",,,,,,,
5008,"Santa Maria della Provvidenza a Valle Aurelia","Via degli Embrici 32",,,,,,,"Blessed Virgin Mary","Roman Catholic","St Mary of Providence",,,,,,,
4894,"Santa Maria della Provvidenza alla Fondazione Don Carlo Gnocchi","Via di Casal del Marmo 401",,,"20th century",,,,"Blessed Virgin Mary (Our Lady of Providence)","Roman Catholic","St Mary of Providence of the Foundation of Don Carlo Gnocchi",,,,,,,
3353,"Santa Maria della Purificazione ai Monti","Via delle Sette Sale",,,1600,,,,"Blessed Virgin Mary (Purification of Our Lady)","Roman Catholic","St Mary of the Purification at Monti",,,,,,Demolished,
4517,"Santa Maria della Purificazione in Banchi","Corso Vittorio Emanuele (in roadway at junction with Via di Banco di Santo Spiritu)",,,Mediaeval,,,,"Blessed Virgin Mary (Purification of Our Lady)","Roman Catholic","St Mary of the Purification of the Bridge",,,,,,Demolished,
4465,"Santa Maria della Purità in Borgo",,,,"16th century",,,,"Blessed Virgin Mary","Roman Catholic","St Mary of Purity in the Borgo",,,,,,,
2082,"Santa Maria della Quercia","Piazza della Quercia 27",,,1727,,,,"Blessed Virgin Mary","Roman Catholic","St Mary of the Oak Tree",,,,,,,
4501,"Santa Maria della Riforma","Via della Consulta",,,"1735; 1889 as chapel",,,,"Blessed Virgin Mary","Roman Catholic","St Mary of Reform",,,,,,Deconsecrated,
4782,"Santa Maria della Salute","Via Tommaso De Vio 5",,,1960,,,,"Blessed Virgin Mary","Roman Catholic","St Mary of Health",,,,,,,
3356,"Santa Maria della Sanità","Piazza di Viminale",,,"17th century",,,,"Blessed Virgin Mary","Roman Catholic","St Mary of Health",,,,,,Demolished,
2083,"Santa Maria della Scala","23 Piazza della Scala",,,1593-1610,,"Discalced Carmelite friars",,"Blessed Virgin Mary","Roman Catholic","Our Lady of the Staircase",,,,,Diaconate,,
4979,"Santa Maria della Speranza a Pratolungo","Via Urzulei",,,"20th century",,,,"Blessed Virgin Mary","Roman Catholic","St Mary of Hope at Pratolungo",,,,,,,
5010,"Santa Maria della Speranza a Val Melaina","Via Cocco Ortu 19",,,1995,,,,"Blessed Virgin Mary","Roman Catholic","St Mary of Hope",,,,,,,
3359,"Santa Maria della Visitazione a Collatino","Via dei Crispolti 142",,,1971,,,,"Blessed Virgin Mary (Visitation)","Roman Catholic","St Mary of the Visitation at Collatino",,,,,,,
3360,"Santa Maria della Visitazione all'Aurelio","Via di Torre Rossa 21",,,"20th century",,,,"Blessed Virgin Mary (Visitation)","Roman Catholic","St Mary of the Visitation at Aurelio",,,,,,,
2063,"Santa Maria della Vittoria","17 Via XX Settembre","Carlo Maderno","See text",1603,,,,"Blessed Virgin Mary","Roman Catholic Church","Our Lady of Victory",,"Santa Maria della Vittoria exterior.jpg",No,,"Sean Cardinal O'Malley",,
3364,"Santa Maria delle Grazie a Casal Boccone","Via Luigi Carrer 43",,,2010,,,,"Blessed Virgin Mary (Our Lady of Graces)","Roman Catholic","St Mary of Graces at Boccone Farm",,,,,,,
3372,"Santa Maria delle Grazie a Porta Angelica","Via di Porta Angelica (south corner at junction with Borgo Angelico)",,,"Early 17th century",,,,"Blessed Virgin Mary","Roman Catholic","St Mary of Graces at the Angelic Gate",,,,,,"Deconsecrated and demolished",
4445,"Santa Maria delle Grazie al Foro Romano","Via della Consolazione 4",,,"15th century",,,,"Blessed Virgin Mary","Roman Catholic","St Mary of Graces at the Roman Forum",,,,,,Deconsecrated,
4412,"Santa Maria delle Grazie al Trionfale","Piazza Santa Maria delle Grazie 5",,,1941,,,,"Blessed Virgin Mary (Our Lady of Graces)","Roman Catholic","St Mary of Graces at Trionfale",,,,,,,
3370,"Santa Maria delle Grazie alle Fornaci","Piazza di Santa Maria alle Fornaci 30",,,"Late 17th century",,,,"Blessed Virgin Mary (Our Lady of Graces)","Roman Catholic","St Mary of the Graces at the Furnaces",,,,,,,
4448,"Santa Maria delle Grazie nel Cimitero in Laterano","Ospedale delle Donne, Via di San Giovanni in Laterano",,,"19th century",,,,"Blessed Virgin Mary","Roman Catholic","St Mary of Graces in the Lateran Cemetery",,,,,,Deconsecrated,
3371,"Santa Maria delle Lauretane","Via di San Giovanni in Laterano 33",,,1739,,,,"Blessed Virgin Mary (Our Lady of Loreto)","Roman Catholic","St Mary of the Laurel Places",,Maria_delle_Lauretane.jpg,,,,,
3343,"Santa Maria dell’Olivo","Via Rubellia 7",,,1923,,,,"Blessed Virgin Mary","Roman Catholic","St Mary of the Olive Tree",,,,,,,
3344,"Santa Maria dell’Orazione a Setteville","Via Anticoli Corroda 80, Setteville Guidonia",,,2002,,,,"Blessed Virgin Mary","Roman Catholic","St Mary of Prayer at Setteville",,,,,,,
3602,"Santa Maria dell’Oriente","Via Ollastra Simaxis",,,"20th century",,,,"Blessed Virgin Mary","Roman Catholic","St Mary of the East",,,,,,,
5003,"Santa Maria dell’Orto dell’Istituto Antonio Maria Gianelli","Via Mirandola 15",,,"20th century",,,,"Blessed Virgin Mary","Roman Catholic","St Mary of the Garden of the Institute of Anthony Mary Gianelli",,,,,,,
3114,"Santa Maria di Grottapinta","Via di Grotta Pinta 21",,,1599,,,,"Blessed Virgin Mary","Roman Catholic","St Mary of the Painted Cave",,,,,,Deconsecrated,
5028,"Santa Maria di Loreto a Boccea","Via di Boccea 1417",,,"20th century",,,,"Blessed Virgin Mary","Roman Catholic","St Mary of Loreto in the Box Wood",,,,,,,
3368,"Santa Maria di Loreto a Castelverde","Via Santa Maria di Loreto 9, Castelverde di Lunghezza",,,"Mid 20th century, 21st century",,,,"Blessed Virgin Mary (Our Lady of Loreto)","Roman Catholic","St Mary of Loreto at Greencastle",,,,,,,
4634,"Santa Maria di Loreto al Foro Traiano","26 Piazza Madonna di Loreto  00187 Roma","Antonio da Sangallo the Younger, Jacopo del Duca","Andrea Sansovino, Cesare Mariani",1507,,Diocesan,,"Blessed Virgin Mary","Roman Catholic Church","Our Lady of Loreto",,,,"06 67 92 235",,,
3420,"Santa Maria di Nazareth","Via di Boccea 590",,,"1960, 2015",,,,"Blessed Virgin Mary","Roman Catholic","St Mary of Nazareth",,,,,,,
3421,"Santa Maria di Porcareccia","Piazza del Castello di Porcareccia 1 (within the castle)",,,"17th century",,,,"Blessed Virgin Mary","Roman Catholic","St Mary of Porcareccia",,,,,,,
2048,"Santa Maria in Aquiro","Via della Guglia 69/B",,,1588-1774,,,,"Blessed Virgin Mary","Roman Catholic","St Mary in ""Aquiro"" (meaning unknown)",,,,,,,
2021,"Santa Maria in Aracoeli","4 Piazza del Campidoglio  00186 Roma",,"Carlo Rainaldi<nowiki>, Andrea Sansovino, Andrea Bregno et al.</nowiki>",,,,,"Blessed Virgin Mary","Roman Catholic Church","Our Lady at the Heavenly Altar",,Maria_in_Aracoeli.jpg,,"06 69 76 38 38","Salvatore De Giorgi","Titular church",
3442,"Santa Maria in Cacaberis","Via di Santa Maria dè Calderari",,,Mediaeval,,,,"Blessed Virgin Mary","Roman Catholic","St Mary in the Copper Pot",,,,,,,
2051,"Santa Maria in Campitelli","9 Piazza di Campitelli00186 Roma","Carlo Rainaldi","Melchior Cafà, Il Baciccia","1659- 1667",,,,"Blessed Virgin Mary","Roman Catholic Church","Our Lady at Campitelli",,,,06-68.80.39.78,"Cardinal Montezemolo","Titular church",
